{
  "schemaVersion": "2",
  "families": [
    "api",
    "web",
    "mobile"
  ],
  "contract": {
    "id": "platform-baseline",
    "version": "2.0.0",
    "source": "factory/conformance/contracts/platform-baseline.v2.json"
  },
  "generatedFrom": {
    "systemDigest": "repository-scan",
    "resolutionDigest": "repository-scan",
    "planDigest": "repository-scan"
  },
  "evaluation": "structural",
  "apps": [
    {
      "id": "nestjs",
      "kind": "api",
      "runtime": "nestjs",
      "family": "api",
      "level": "GENERATABLE",
      "baseline": {
        "contractVersion": "common/2.0.0",
        "invariants": {
          "configuration": {
            "status": "compliant",
            "evidence": "validated/typed configuration seam found",
            "source": "structural"
          },
          "canonical-errors": {
            "status": "compliant",
            "evidence": "canonical error mapping found",
            "source": "structural"
          },
          "structured-logging": {
            "status": "compliant",
            "evidence": "structured request logging found",
            "source": "structural"
          },
          "correlation": {
            "status": "compliant",
            "evidence": "correlation propagation seam found",
            "source": "structural"
          },
          "observability": {
            "status": "compliant",
            "evidence": "request metrics, W3C trace propagation and versioned OpenTelemetry hook behavior tested",
            "source": "behavioral-test"
          },
          "technical-audit": {
            "status": "compliant",
            "evidence": "technical audit service/sink found",
            "source": "structural"
          },
          "security-baseline": {
            "status": "compliant",
            "evidence": "bounded CORS, security headers and rate limiting behavior covered",
            "source": "behavioral-test"
          },
          "health": {
            "status": "compliant",
            "evidence": "runtime health signal found",
            "source": "structural"
          },
          "diagnostics": {
            "status": "partial",
            "evidence": "canonical errors and health provide partial diagnostics",
            "source": "structural"
          },
          "testing-foundation": {
            "status": "compliant",
            "evidence": "test foundation found",
            "source": "structural"
          },
          "lifecycle-hooks": {
            "status": "compliant",
            "evidence": "runtime lifecycle transitions and shutdown hooks behavior tested",
            "source": "behavioral-test"
          },
          "extension-points": {
            "status": "compliant",
            "evidence": "versioned extension registry behavior tested",
            "source": "behavioral-test"
          },
          "build-quality-gates": {
            "status": "compliant",
            "evidence": "build/test gates found",
            "source": "structural"
          }
        }
      },
      "familyContract": {
        "contractVersion": "api/2.0.0",
        "invariants": {
          "http-server": {
            "status": "compliant",
            "evidence": "NestJS bootstrap",
            "source": "structural"
          },
          "input-validation": {
            "status": "compliant",
            "evidence": "global validation pipe",
            "source": "structural"
          },
          "canonical-http-errors": {
            "status": "compliant",
            "evidence": "error shape: flat-envelope (canonical target: flat-envelope)",
            "source": "structural"
          },
          "openapi": {
            "status": "compliant",
            "evidence": "3 operations",
            "source": "structural"
          },
          "health-liveness-readiness": {
            "status": "compliant",
            "evidence": "openapi ops: health_get, health_live, health_ready",
            "source": "structural"
          },
          "persistence-ports": {
            "status": "compliant",
            "evidence": "PrismaService",
            "source": "structural"
          },
          "migration-ports": {
            "status": "compliant",
            "evidence": "prisma/migrations",
            "source": "structural"
          },
          "transaction-ports": {
            "status": "partial",
            "evidence": "Prisma transaction access, no neutral port",
            "source": "structural"
          },
          "authentication-hook": {
            "status": "compliant",
            "evidence": "versioned AuthenticationHook registry behavior tested",
            "source": "behavioral-test"
          },
          "authorization-hook": {
            "status": "compliant",
            "evidence": "versioned AuthorizationHook registry behavior tested",
            "source": "behavioral-test"
          },
          "file-hook": {
            "status": "compliant",
            "evidence": "versioned FileHook registry behavior tested",
            "source": "behavioral-test"
          },
          "event-hook": {
            "status": "compliant",
            "evidence": "versioned EventHook registry behavior tested",
            "source": "behavioral-test"
          },
          "graceful-shutdown": {
            "status": "compliant",
            "evidence": "signal hooks and idempotent reverse shutdown behavior tested",
            "source": "behavioral-test"
          },
          "contract-tests": {
            "status": "compliant",
            "evidence": "API contract/e2e tests",
            "source": "structural"
          },
          "rate-limiting": {
            "status": "compliant",
            "evidence": "common/throttling (base mechanism)",
            "source": "structural"
          }
        }
      },
      "nonConformant": [],
      "diagnostics": [
        {
          "code": "BASELINE_INVARIANT_PARTIAL",
          "severity": "warning",
          "path": "apps.nestjs.baseline.diagnostics",
          "invariant": "diagnostics",
          "status": "partial",
          "evidence": "canonical errors and health provide partial diagnostics"
        },
        {
          "code": "FAMILY_INVARIANT_PARTIAL",
          "severity": "warning",
          "path": "apps.nestjs.api.transaction-ports",
          "invariant": "transaction-ports",
          "status": "partial",
          "evidence": "Prisma transaction access, no neutral port"
        }
      ]
    },
    {
      "id": "spring",
      "kind": "api",
      "runtime": "spring",
      "family": "api",
      "level": "GENERATABLE",
      "baseline": {
        "contractVersion": "common/2.0.0",
        "invariants": {
          "configuration": {
            "status": "partial",
            "evidence": "validated/typed configuration seam found",
            "source": "structural"
          },
          "canonical-errors": {
            "status": "compliant",
            "evidence": "canonical error mapping found",
            "source": "structural"
          },
          "structured-logging": {
            "status": "compliant",
            "evidence": "structured request logging found",
            "source": "structural"
          },
          "correlation": {
            "status": "compliant",
            "evidence": "correlation propagation seam found",
            "source": "structural"
          },
          "observability": {
            "status": "compliant",
            "evidence": "request metrics, W3C trace propagation and versioned OpenTelemetry hook behavior tested",
            "source": "behavioral-test"
          },
          "technical-audit": {
            "status": "compliant",
            "evidence": "technical audit service/sink found",
            "source": "structural"
          },
          "security-baseline": {
            "status": "compliant",
            "evidence": "bounded CORS, security headers and rate limiting behavior covered",
            "source": "behavioral-test"
          },
          "health": {
            "status": "compliant",
            "evidence": "runtime health signal found",
            "source": "structural"
          },
          "diagnostics": {
            "status": "partial",
            "evidence": "canonical errors and health provide partial diagnostics",
            "source": "structural"
          },
          "testing-foundation": {
            "status": "compliant",
            "evidence": "test foundation found",
            "source": "structural"
          },
          "lifecycle-hooks": {
            "status": "compliant",
            "evidence": "runtime lifecycle transitions and shutdown hooks behavior tested",
            "source": "behavioral-test"
          },
          "extension-points": {
            "status": "compliant",
            "evidence": "versioned extension registry behavior tested",
            "source": "behavioral-test"
          },
          "build-quality-gates": {
            "status": "partial",
            "evidence": "build/test gates found",
            "source": "structural"
          }
        }
      },
      "familyContract": {
        "contractVersion": "api/2.0.0",
        "invariants": {
          "http-server": {
            "status": "compliant",
            "evidence": "Spring Boot application",
            "source": "structural"
          },
          "input-validation": {
            "status": "partial",
            "evidence": "Jakarta validation error handling",
            "source": "structural"
          },
          "canonical-http-errors": {
            "status": "compliant",
            "evidence": "error shape: flat-envelope (canonical target: flat-envelope)",
            "source": "structural"
          },
          "openapi": {
            "status": "compliant",
            "evidence": "springdoc OpenApiConfig",
            "source": "structural"
          },